book_id,title,author,isbn,publication_year,genre,age_classification,publisher,description,average_rating,number_of_ratings
1,Back job treatment,Courtney Fox,978-1-4421-1381-7,1986,"Politics, Science, Classics, Horror",Picture Books,Taylor Inc,Seek have establish without use yet. Majority fish blue personal.,2.2,102414
2,Main wrong water represent,Kelly Jenkins,978-0-8327-5942-0,1995,"Historical Fiction, Western",Young Adult (YA),"Jordan, Marshall and Carson",Place result five international miss employee. Her tonight recently trial seven cause effect. Job front wrong learn rate actually.,1.3,1670971
3,Million fact serious fund,Lisa Young,978-1-56168-736-7,2006,"Philosophy, Feminist, Romance",Early Readers,"Maynard, Mcgee and Scott",May number protect age few later much. Lay article arm news during none. Trip pretty daughter person though. Development majority speech American yet instead effort.,2.1,3666218
4,Sing detail from,Kent Li,978-1-4194-8463-6,1985,"Business, Historical Fiction",Chapter Books,"Lawrence, Waller and Hall",Democratic growth fill until against bag. Letter way stand court traditional. Put issue together candidate ago memory line.,3.3,1286394
5,Nearly argue evidence kitchen value,Erin Washington,978-0-06-053367-0,2020,"Self Help, Travel",Teens,"Sanford, Baldwin and Hudson",Pick carry spring.,2.9,4081516
6,Serve arm military once series,Leslie Taylor,978-1-279-45793-1,1992,"Nonfiction, Humor and Comedy",Picture Books,"Tyler, Velez and Young",Thousand fly yourself town. Deal my garden loss power find thing. Leader very family us so development blood.,2.6,877741
7,Could rate,Robert Allen,978-0-7720-6734-0,1975,"Classics, Psychology",Picture Books,White-Garcia,Doctor animal thank challenge kitchen. How case response never station enter.,1.1,1111103
8,Method effect past week rich,Samantha Fox,978-0-7902-2364-3,2016,Paranormal,Picture Books,"Watson, Parker and Miller",Seat develop star establish send military event good. Use clearly left door show inside.,2.0,1459376
9,Red environmental choice share word,Michael Miller,978-0-86981-578-6,1981,"True Crime, Contemporary, History",Chapter Books,Brewer Ltd,Court quickly owner firm. Prevent indicate participant around husband news my wish.,1.3,349882
10,Heart together explain mission,April Mcgee,978-0-08-463678-4,2016,Cookbooks,Picture Books,Garner LLC,Newspaper toward maybe father might. The forward need. Sing pass well hard have.,3.3,317271
11,Still thought,Clinton Howard,978-0-492-22990-5,2024,"Psychology, Horror, Philosophy, Fantasy",Picture Books,"Huff, Carter and Mcmillan",Customer son particular whole prepare answer. Result what hotel ago. Forget west together admit.,4.4,3685816
12,Prove line hundred can,Nathan Johnson,978-0-88369-120-5,2014,"Psychology, Comics, Music, Christian",Picture Books,Rose-Smith,Quite computer information attorney better fish base. Common source phone start program church between. Fine something possible thought likely single we voice.,2.6,1770818
13,Happy home television,Thomas Mclean,978-0-02-568172-9,2009,"Satire, Spirituality",Adult,Knight LLC,Development piece through benefit inside anyone. Technology nor strategy her. National teach movement she news thing risk. Around wonder our play ago through.,4.6,1823752
14,While girl gun piece about,Janice Chambers,978-1-77254-888-4,1982,"Western, Politics, Biography, Fantasy",Picture Books,Smith Ltd,If fall down skill father matter. Need bag not deal against interesting.,4.3,205549
15,Raise operation worker,James Waters,978-0-19-359687-0,1976,"Action and Adventure, Music",Adult,Rios-Evans,Yet community father near upon certain today. Money career better wind.,1.1,963733
16,Safe the,Meghan Cruz,978-1-119-42938-8,2024,"Romance, Action and Adventure",Chapter Books,"Jackson, Collins and Camacho",Paper use she. Fine myself leg particularly book economy show. Happen true southern well.,2.2,1890054
17,Walk lay,Sheri Simpson,978-0-19-981746-7,1994,"Art, Christian",Picture Books,"Higgins, Hardy and Schultz",Carry environmental mean only across long share. Into east fund tend kitchen sea.,2.2,1060842
18,Take lay,Jeffery Coleman,978-1-256-91161-6,1983,"Historical Fiction, Manga",Chapter Books,"Blackburn, Brown and Mack",Describe note traditional house alone action data. Base available life no push hour.,4.7,1996069
19,Other face,Sandra Nunez,978-0-558-43109-9,2001,Travel,Chapter Books,Patterson-Paul,Only realize father. National let man moment.,2.9,437192
20,Control media population,Ryan Sims,978-1-908416-41-4,2022,"Spirituality, Action and Adventure",Young Adult (YA),"Cook, Jones and Potter",Health newspaper travel. With energy guess party increase.,2.9,1238839
21,Professor or my throw newspaper,Nicholas Green,978-0-608-81621-0,1979,"Music, Science",Young Adult (YA),Mccoy-Lewis,Tend help late those do begin.,1.0,1493839
22,Might American arm,Mark Vincent,978-1-393-93906-1,2014,"Spirituality, Nonfiction",Chapter Books,"Booth, Cox and Cook",When opportunity and cultural account operation. Key particular themselves paper less have some. Ask animal everything investment girl actually.,3.1,515228
23,Lot child,Natasha Rodriguez,978-0-473-77663-3,1973,"Humor and Comedy, Religion, Memoir",Picture Books,Guzman-Richardson,Approach show federal arrive draw list. Finally well shoulder foreign possible.,2.0,1561869
24,Simple be fund page people,Michelle Miller,978-0-208-57848-8,2003,Comics,Teens,Ford Ltd,The imagine interest able their cup car impact. Situation add change show continue scene civil.,2.3,356061
25,Source western animal exist southern,Rhonda Moore,978-1-181-34541-8,2004,"Art, Contemporary",Picture Books,Robinson-Norton,Can together face likely rise could. Board nation of large total institution onto. Goal available few card.,4.7,295040
26,Some agent father reflect,Amy Munoz,978-1-65987-942-1,1993,Spirituality,Chapter Books,Stanton-Rivera,What food light several job billion by. Could price director agent level big.,2.2,720753
27,Few financial,Scott Diaz,978-1-66386-403-1,2016,Short Stories,Teens,"Butler, Flynn and Meadows",Factor look safe beautiful stay. Debate usually data reason month daughter.,4.9,1982385
28,Country plan interesting fill,Latasha Lopez,978-1-237-28298-8,2002,Travel,Chapter Books,Lara-Myers,Beyond forget event series study wonder capital. Police rule air successful a then.,4.9,1451819
29,Party address road piece recent,Jade Rowland,978-0-613-66349-6,1992,"Contemporary, Feminist",Young Adult (YA),Morrison-Thomas,Lot lot charge above. You customer control yes several. Student describe rich major kid agreement.,2.0,436331
30,Wish include garden,Courtney Garcia,978-0-908490-63-9,2020,"Philosophy, Mystery, Action and Adventure",Chapter Books,Sanchez-Armstrong,Machine create tend single order. Your hospital responsibility thing room task challenge concern. Find week include minute include perhaps soldier.,1.7,1114517
31,Past hour television structure network,Mary Miller,978-1-66151-561-4,2010,"Satire, Contemporary",Teens,Garner PLC,Everything floor individual far be what animal tend. Address writer region culture.,1.2,601673
32,Travel design,Michelle Smith,978-0-10-963817-5,1984,"Comics, Short Stories, Religion",Adult,"Walker, Kennedy and Thomas",Born put customer despite.,3.3,554157
33,Three science it,Allison Johnson,978-0-416-83984-5,2023,Philosophy,Early Readers,Mendez-Johnson,Wear beautiful still imagine camera factor hear. Democrat section quite front. Someone really own four bag power despite machine.,4.2,568687
34,On tough run,Dylan Reed,978-1-62538-569-7,2023,Psychology,Early Readers,"Zuniga, Ramirez and Marks",Language very herself within strategy view. Expert throw serious step study break senior perform. Build bar south.,4.9,553703
35,Surface or,Maria Wilkerson,978-1-387-92913-9,2024,Mystery,Chapter Books,Ross LLC,Address teacher minute maintain. Such about industry member thus newspaper. Member gas mean than.,1.5,1378617
36,Not phone else book,Kerry Bridges,978-0-89205-907-2,1986,"Music, Biography, Romance",Young Adult (YA),"Neal, Thomas and Reynolds",Sense treatment future which there issue tend at. Heavy woman condition effect security.,1.7,6153020
37,Office instead kid,Tonya Campbell,978-0-7581-5481-1,2013,Business,Early Readers,Hayes-Lewis,Short enough tough cultural Mr there rate. Bar fly walk value.,2.7,1791260
38,School response air trial,Mary Pham,978-1-399-30241-8,2006,"Memoir, Religion",Young Adult (YA),Hernandez-Zhang,Thank rest door education fish indicate. Budget out similar rather station. Myself huge truth direction age artist here.,3.5,1979261
39,View production,Tara Thompson,978-0-8470-8070-0,2007,"Classics, Satire",Adult,Cox-Harris,Series strategy that. Central fire agreement here nature others later strategy.,1.1,2008846
40,Look since there personal pretty,Brittany Newman,978-1-5090-2832-0,2001,"Spirituality, Historical Fiction",Early Readers,Diaz Ltd,Low ball herself. We there control five administration difference lose. Century true field if I now score recent.,3.2,1513305
41,But choice,Rebecca Wolfe,978-1-395-57351-5,1970,"Psychology, Horror",Picture Books,Lang-Moore,Test method speak result up seat. Although central onto society himself poor. Light put service soon.,1.8,413934
42,Drive prevent campaign he,Cheyenne Reynolds,978-0-00-156678-1,1999,"Politics, Feminist, Art",Young Adult (YA),Harrington-Bates,Year with feel yourself. Future year from. Key professional before work ready medical collection perhaps.,3.7,953680
43,Accept through social find,Kathryn Neal,978-0-525-45865-4,1976,"Art, Western, Nonfiction, Paranormal",Chapter Books,Gray Group,Difficult skill someone determine behavior if. Year among especially but. Stuff car agency.,1.0,380353
44,Enter seem difference third,Patricia Orr,978-1-4905-5053-4,2018,"Crime, Manga, Paranormal, True Crime",Chapter Books,Dickerson-Hancock,Ok air campaign month sort music reach. Baby indeed American weight service somebody. Player bag front.,2.3,436436
45,Price care price all,Angela Reeves,978-0-9517285-8-1,1980,"Paranormal, Nonfiction",Picture Books,"Stanley, Ponce and Galvan",Add civil exist. He paper better discussion ready enjoy. Education interview head section.,4.4,952567
46,Understand somebody avoid drive season,Frederick Stevens,978-0-02-872513-0,2006,Politics,Chapter Books,Nicholson-Salinas,International religious off manager. Part data home fight radio my positive. Know according avoid short vote.,4.7,1957144
47,Area matter score,Cynthia Williams,978-0-9920836-5-6,2009,"True Crime, Contemporary, Art",Young Adult (YA),Riggs-Nash,Address reach member play style into close. Investment trial Republican peace no right. Second recognize only material.,2.7,1242559
48,Star because drop,Christopher Hines,978-1-996311-38-7,2017,"Classics, Humor and Comedy, Poetry, Spirituality",Chapter Books,Stone PLC,More require environmental best responsibility. Bag break report how study save his alone.,2.7,1592189
49,Success respond able board,Joseph Riley,978-0-18-441768-9,1988,"True Crime, Suspense and Thriller",Adult,Woods-King,Discover than stage shake write. Mother Mr peace key then baby. Officer hour single bag total out.,1.2,1567023
50,Fall apply my which finally,Christopher Bush,978-0-86668-857-4,2017,Psychology,Picture Books,Padilla PLC,Wish painting early might. Moment Democrat adult be national research chair hundred.,4.4,66707
51,Child low visit behind write,Miranda Powers,978-1-5184-3404-4,1973,Paranormal,Early Readers,Martinez Inc,Federal civil first six certainly television. Person remain hit couple executive section according.,4.3,1698449
52,Husband one response friend,Eric Dixon,978-1-58250-846-7,2004,"Fantasy, Science Fiction, Manga, Science",Adult,"Anderson, Lopez and Mooney",Staff herself tax future share. Among officer local evidence inside. Benefit enough water consider.,1.9,1589635
53,Able unit man likely,Heidi Ferguson,978-0-7179-6391-1,1983,Fantasy,Teens,Lee Ltd,Seat west think entire two oil ever. Thank born keep ready paper walk kid.,2.7,2126163
54,Social small put TV,Mason Higgins,978-0-85498-967-6,1998,"Fantasy, Romance",Young Adult (YA),"Wilson, Bauer and Mcclure",Between day television grow. Law economy remember end card.,3.3,1593438
55,According foot look,Heather Palmer,978-0-15-718452-5,2011,"Paranormal, Poetry, Religion",Early Readers,Ellis LLC,Member production current mean finish listen fill. After Mrs perform others together big.,3.3,1179161
56,Successful sometimes bag personal,Bryan Doyle,978-1-374-31739-0,2021,"History, Business, Satire, Contemporary",Teens,"Welch, Adams and Vargas",How song until stuff analysis. Mother always sell study of.,4.8,1512939
57,Loss reality,Monica Olson,978-0-12-231644-9,2009,"Christian, Politics, True Crime",Chapter Books,"Yoder, Hernandez and Morse",Country concern allow issue record happy site than. Himself nothing really scene single second remember. How business detail establish turn item.,4.8,1632146
58,Return too know,Amy Harris,978-1-107-91210-6,2002,"Manga, Historical Fiction",Early Readers,Roy LLC,Value current home member. Camera everyone century network employee.,2.5,779008
59,Vote decision stand personal agency,Erica Finley,978-1-01-059755-1,2022,Satire,Picture Books,Cochran and Sons,About as reality environment. Themselves age member dream worry kid. During plant image.,2.1,1739248
60,Call big reflect,Marissa Moyer,978-0-15-116935-1,2016,"Crime, Romance, Humor and Comedy, LGBTQ+",Teens,Carpenter and Sons,Question way budget media event.,2.0,721947
61,Perform commercial what,Daniel Robinson,978-1-61532-726-3,1982,Manga,Chapter Books,Little PLC,Tough PM ready meeting. Walk help son become second area. None cover admit raise. Statement by society medical economic region.,1.6,182644
62,Guess long toward matter fund,Lisa Sanchez,978-1-879236-36-3,2010,"History, Spirituality",Teens,Mullen Group,Reduce feeling through professional. Trial thousand agree style worker win black.,3.3,1907062
63,On life,Chase Morrow,978-1-243-74937-6,2010,"Philosophy, Romance, Art",Young Adult (YA),Grant-Frazier,Space truth see wonder box street. Large she every real opportunity large. Certain stand effect money movie.,3.1,5088539
64,Your small,Kristie Williams,978-0-663-89714-8,1996,Business,Chapter Books,"Lopez, Davis and Wood",Something watch than model gas. Question any cold.,3.7,515471
65,Collection change though,Jesus Wilson,978-1-920348-00-7,1973,"Self Help, Business",Adult,Smith PLC,Baby reality speech thing person member. Program off mention president coach.,1.0,1053493
66,Discussion police child,Shelley Davis,978-0-440-88298-5,2000,Spirituality,Picture Books,Curry-Mitchell,Everything conference national coach space. Image point until inside article. Financial president fear.,3.7,54684
67,Institution activity thus especially,Timothy Butler,978-1-9817-6513-3,1993,"Classics, Christian, Cookbooks, Romance",Chapter Books,Smith Ltd,Board always similar everything fire quality green. Whatever behind sea event. Information center include maybe.,3.7,282643
68,Cup all,Christopher Young,978-0-9699931-8-6,1971,"Philosophy, Crime",Young Adult (YA),Stewart LLC,Line especially class building. Such above easy foot serious.,4.5,7669013
69,Deep word yourself,Michelle Yates,978-0-479-31595-9,1997,Christian,Young Adult (YA),"Harris, Hawkins and Rodriguez",Value particular four scientist. Her technology mother strategy. Natural line wish range color.,3.9,1380337
70,Where lay spend,Javier Hughes,978-0-00-725889-5,1970,Mystery,Picture Books,Garcia-Long,Himself second cause big. Building center war drug allow several may.,2.8,1060139
71,Development born until whose appear,Austin Santana,978-0-618-89515-1,2008,"Fantasy, Psychology, Feminist",Young Adult (YA),Torres-Perez,Fear decision find experience worker myself. Actually truth past quickly perhaps effort.,4.8,7055896
72,Shoulder provide wide country,Marie Waters,978-1-69785-703-0,1988,"Christian, LGBTQ+, Fantasy",Teens,Powers-Martinez,Light space phone simple nature. Citizen according eye purpose mission race.,1.0,3992181
73,Lawyer quickly anyone hospital help,Kimberly Hall,978-1-64313-128-3,2000,"Cookbooks, Travel",Chapter Books,Harris Ltd,Everything parent position answer establish. Agency analysis clear would building.,3.2,614919
74,Wind stay start there,Zoe Rasmussen,978-0-7074-6021-5,1992,"Psychology, Religion, Self Help, LGBTQ+",Picture Books,Turner Group,Part full surface choose just pressure have. Claim this why occur.,2.3,1575353
75,Leave mind,James Hernandez,978-1-883617-57-8,1972,Spirituality,Early Readers,"Jones, Kirby and Burnett",One wonder skill political forget responsibility. Computer other quality performance boy choice. Record television so short many.,4.1,1571977
76,Political build whatever,Lisa Bowman,978-1-81859-805-7,1991,Art,Early Readers,"King, Chavez and Jacobson",Season enough more film interview miss. Nice have be always represent drive.,3.5,3855676
77,Hit customer shoulder,Courtney Moore,978-1-258-02090-3,1983,"Music, Humor and Comedy",Chapter Books,Kennedy Inc,Bad small statement bag. Coach rule individual administration man. Blood wish six rock. Drop better deal.,3.4,2540266
78,Hundred century bit pretty,Juan Gonzalez,978-1-81648-846-6,1996,"Classics, Psychology, Science, History",Teens,Malone-Foley,Character surface with mind let wife Mr. Interesting example lot manage world recent.,1.4,1635117
79,Figure real add,Amy Downs,978-0-7742-5451-9,2018,Business,Young Adult (YA),"Garcia, Meyer and Elliott",Television save ready certain. Talk imagine size professor ability area. Hair morning trouble it finish simply company.,4.8,1526577
80,Plan produce,Samuel Arellano,978-0-7658-1731-0,1988,Cookbooks,Young Adult (YA),Patterson Inc,Accept cost century. Exist among after just watch maintain. Artist social agreement person.,4.7,6899460
81,Up game believe talk,Judy Davis,978-0-457-01007-4,1992,"Biography, Contemporary, Romance",Young Adult (YA),Larson-Moyer,This big act shoulder. Class big probably room street center admit. Road church community usually as.,4.4,7489716
82,Make rich,Joshua Collins,978-1-64555-890-3,2015,"Contemporary, Memoir",Young Adult (YA),Cruz Inc,Small up throughout career phone middle. Agree as evidence father your. Stuff election heart attorney. Campaign garden yard form.,3.1,752997
83,Wonder yard act fight how,Andrew Butler,978-1-84244-423-8,1975,"Nonfiction, Politics, Action and Adventure, Science",Early Readers,Martin Group,From artist purpose. Include rest good against federal cover yes. Important road company focus whole.,3.5,300627
84,Line while paper,Cheryl Weaver,978-1-257-51396-3,2009,"Classics, Science, Contemporary",Teens,Cook-Butler,Crime alone industry give environment organization attack.,3.1,164716
85,Reveal tough energy,Daniel Martinez,978-0-9723526-1-1,2017,"Western, Philosophy, Cookbooks",Young Adult (YA),Travis Group,Avoid culture price here. Away foot create. West nature spring.,4.2,3443436
86,Back these indicate certainly,Steve Roy,978-1-76577-199-2,2003,Satire,Early Readers,"Mays, Brown and Fowler",Hand daughter through pressure we. Market final pattern poor.,3.9,1525634
87,Whatever least issue meeting,Theresa Rios,978-1-7327849-6-3,1990,"Poetry, Art",Teens,Wallace PLC,Local environment its service. Article line prove nature.,1.1,1518466
88,Establish husband,Katelyn Preston,978-1-4699-6015-9,2024,"Science, Politics, Art, Suspense and Thriller",Chapter Books,Sanders PLC,Music son arm. Meeting exactly off article many possible nation. Run sing important everyone.,2.2,1778779
89,Partner science act,Sheila Diaz,978-1-69895-278-9,2022,"Cookbooks, Action and Adventure, Western",Chapter Books,"Ruiz, Hodge and Lin",Reduce research pretty guess woman left start. Word with nearly cultural.,1.8,395854
90,Shoulder born away clearly man,Sharon Brown,978-0-430-19615-3,1972,"Poetry, Spirituality",Adult,"Huang, Jackson and Lawson",Real art church generation. Hotel tree perform trip summer huge relate himself.,4.1,1611825
91,North none travel top until,Ryan Green,978-1-143-88040-7,1994,"Politics, Cookbooks, Philosophy, Mystery",Adult,Ramsey PLC,Price mouth raise manage. Price behind interview heavy far space morning occur. Television claim ago too skin structure agreement.,1.2,54373
92,Soon we get,Nicholas Terrell,978-0-04-994058-1,1976,"Cookbooks, Art, Contemporary",Young Adult (YA),Terry-Brown,Pm be expect democratic discussion five kind. Poor write sit. Girl for most hospital.,2.8,966684
93,Expert smile media military tell,Mark Floyd,978-1-229-55777-3,1991,"Art, Politics, Poetry",Young Adult (YA),Ward-Fitzgerald,Among social small state include. Growth man the day a.,1.4,1255981
94,Relationship very set quickly top,Susan Kim,978-0-315-34953-7,1995,"Mystery, Romance",Young Adult (YA),Watts-Jones,Capital some Congress lay. House fast challenge deep simply office.,2.2,1401642
95,Majority court us prove,Mary Chang,978-0-07-362234-7,1978,Western,Chapter Books,Myers-Murphy,Throw high age clear close. Who identify huge friend. Manage teacher whole drop entire.,2.1,548226
96,Include fill see program,Carolyn Mullins,978-0-940188-83-9,2006,"Science, Crime",Chapter Books,Clark-Martin,Soon economic meeting writer top memory. Join ago window describe ball in.,2.9,868597
97,Role article exist,Hannah Velez,978-0-12-261243-5,2024,"Art, Humor and Comedy, Manga, Satire",Teens,Peterson-Johnson,At must after study reach list article. Citizen when main management. Answer shoulder bad.,2.6,1685493
98,Something American company over,Rhonda Williams,978-0-10-396576-5,1995,"Western, Short Stories, Humor and Comedy",Early Readers,Hunt-Young,Because again face seem especially more age. Do best take. Consumer rate experience nothing.,4.4,186715
99,National just look,Shannon George,978-0-392-99941-0,1995,"Memoir, Classics, True Crime",Young Adult (YA),Carter Ltd,Real since key those military magazine start. About offer high believe method option attorney.,2.1,478820
100,Simple him maintain third development,Lisa Rodriguez,978-1-906354-54-1,2006,Comics,Teens,Duncan Group,Top another both operation bed. Month bar car factor husband maybe far.,4.5,997255
101,Data expert decade know,Michelle Sims,978-1-7332543-0-4,1987,"Christian, Nonfiction, Travel, Biography",Young Adult (YA),"Fleming, Lopez and White",Poor one western him both figure. Military Democrat standard site room reduce crime.,3.6,1091865
102,South walk,Wendy Andrews,978-1-66351-034-1,2004,Biography,Teens,Castillo-Conley,Report authority enough perhaps once. Gun other throughout could responsibility.,2.0,996119
103,Outside carry stop,Dr. Adrian Carlson,978-0-16-993831-4,2022,Short Stories,Early Readers,Leonard Ltd,Major trade energy woman city next various. White process low feel crime station.,3.5,1069381
104,Vote from another,Susan Stevens,978-0-376-87711-6,1981,"Comics, Religion, Paranormal, Science",Chapter Books,Carr PLC,Interest instead before debate. Truth free worry weight reach. Executive offer mouth material box space. Someone clearly common step.,2.6,1869098
105,Establish help put,Kathleen Oliver,978-0-18-952919-6,2003,Horror,Early Readers,Bates-Pierce,Every than myself top six know.,3.2,375180
106,Left threat worry,Diamond Rosario,978-1-309-69405-3,2015,"Paranormal, Poetry, Spirituality, LGBTQ+",Adult,Mckee Ltd,Opportunity voice director evening marriage. Color necessary some better.,1.2,5019927
107,Open police,Shannon Vaughn,978-0-87356-822-7,1972,"Crime, Historical Fiction",Young Adult (YA),"Sherman, Sandoval and Cole",While down nation. Most pass smile official record green. Operation scientist project imagine. Agent yet far some thousand.,3.9,612034
108,Majority although score deal left,Steven Webb,978-1-03-048939-3,1985,"Psychology, Feminist, Self Help, Suspense and Thriller",Teens,Medina Group,Foot available very soon by. Buy management low.,3.9,1456151
109,Building writer form little,Leslie Caldwell,978-0-86501-052-9,1994,"Humor and Comedy, Western, Short Stories",Picture Books,Price PLC,Game out add word discover follow main type. Include pass major behind appear. Tax suggest yourself film summer analysis.,4.6,1176632
110,Boy drop crime available development,Crystal Evans,978-0-15-087771-4,1987,Psychology,Adult,"Mitchell, Hernandez and Howard",Almost seven describe debate stay once dark. Until once best. Marriage break past him stuff traditional drive.,1.7,1682293
111,Point state itself late,Jennifer Tran,978-0-17-023587-7,2023,Western,Adult,"Reed, Pierce and Schmitt",Player hope wind state understand responsibility high. Thank grow improve series sister issue despite. Stand sound term serve month church mission.,1.6,681130
112,Wear cost Mr Democrat science,Holly Watson,978-1-03-916173-3,1984,Psychology,Young Adult (YA),"Perez, Hayden and Jones",Focus color peace ago factor ahead modern. Four imagine newspaper war explain. Nation social leave choice.,4.8,1328004
113,Think now simply official,Benjamin Lopez,978-1-9796-8731-7,1974,Nonfiction,Chapter Books,Watkins-Garcia,Head data soldier federal speak source word. Star kid book former themselves impact material far.,2.3,148824
114,Yet before church type carry,Danielle Gordon,978-0-515-11422-5,1986,"Mystery, Cookbooks, Action and Adventure, Crime",Adult,Rojas-Rivera,Authority stand shoulder within about anyone. Bad eight story mean television break either each.,2.5,1154377
115,Difference know young some,Anna Collins,978-1-5160-1650-1,1976,"Action and Adventure, Crime, Art",Teens,Alexander-Turner,Station listen into test relate degree. Drive economy southern dark laugh edge write. Around near by for.,4.5,820702
116,Less several,Daniel Fitzpatrick,978-1-273-61864-2,2006,"Feminist, Science, Contemporary, Mystery",Chapter Books,"Johnson, Nguyen and Brady",Stock human my bed girl yourself. Economy cause foreign various grow course matter. Figure machine hotel like one career five. Soon capital drive.,4.1,1231956
