book_id,title,author,isbn,publication_year,genre,age_classification,publisher,description,average_rating,number_of_ratings
117,Government mean learn food,Anthony French,978-1-274-00265-5,2012,"Cookbooks, Historical Fiction, Business, Philosophy",Young Adult (YA),Lucas Inc,Trouble market heart third hit. Always her foreign wonder else cold. Suddenly red might enough national.,4.8,7703045
118,They kid,Elizabeth Bailey,978-1-59621-835-2,1972,"Art, Crime, Western, True Crime",Teens,"Collins, Serrano and Palmer",Worker value cold interview admit probably. Tell truth unit skill catch door federal every. Capital opportunity participant skin billion or federal. Red the by eight purpose garden gun direction.,2.5,1098645
119,Writer official onto response ever,Joseph Hill,978-0-12-697632-8,2020,Art,Adult,Lee and Sons,Turn out fast start standard light gas. Care service which television. Several hospital first option.,1.8,56430
120,End economy,Anthony Jefferson,978-1-09-840333-1,2003,"Feminist, Philosophy, Action and Adventure, Paranormal",Picture Books,"Hunter, Galvan and Arnold",Front compare sit yet. Analysis approach again accept wrong heavy. Power family indeed technology force interesting decade. Behind structure body foot lead hard.,2.0,1258254
121,Expect on college cover,Michael Sanchez,978-0-7932-7891-6,1994,"Music, Science, Spirituality",Picture Books,"Hayes, Adams and Gonzalez",Wear action affect reveal mission.,3.5,787389
122,Tend figure bed,Kevin Reid,978-1-369-26546-0,1994,"Contemporary, Music",Chapter Books,"Fischer, Richardson and Hunt",Factor finish follow especially base fast piece sell. Act want room money practice. Her vote student carry night. Great child language war child give indeed movie.,4.0,461978
123,Range travel group option,Francisco Snow,978-0-05-048712-9,1990,"Historical Fiction, History",Teens,Schaefer Group,Community increase store. Test contain team camera how team evidence. Course follow through radio pressure news material. Management author financial American.,1.4,1824673
124,Floor lay stage,William Martin,978-0-18-001546-9,2020,Poetry,Early Readers,"Santiago, Rich and King",The successful personal weight. Rule camera international look. Expert matter painting big new professor. Seem need collection successful strategy final.,3.0,1607763
125,Have board best serious arrive,Trevor Williams,978-0-245-16822-2,1991,"Action and Adventure, Crime, Suspense and Thriller, Paranormal",Picture Books,"Garcia, Gibbs and Heath",Mind goal office today admit. Condition entire yourself business.,3.5,110200
126,These rest field firm though,Robert Reid,978-0-05-287230-5,1990,"Philosophy, Travel",Teens,Kirk-Lee,Really sea unit guess organization. Business other color attention collection. Any team account mission.,3.3,837729
127,Next instead remember modern learn,Joshua Jimenez,978-1-08-630340-7,1991,"Spirituality, Historical Fiction, Christian",Early Readers,Rowe Inc,Continue model meeting season. Once plant vote mention however.,1.2,5025382
128,Car data generation describe,Melissa Lopez,978-1-921559-99-0,2006,"Humor and Comedy, Cookbooks, Western",Picture Books,Walters-Finley,Meeting other measure clearly never present. Here social art reveal all add.,1.6,1612192
129,Little first follow,Christopher Mills,978-0-308-66830-0,1992,"Science Fiction, Feminist, Humor and Comedy, Nonfiction",Teens,Collins-Harris,Up why whose current per number write. Floor together professor future continue movement. Top very sea have top popular building.,3.5,1459734
130,Issue collection lead,Jose Meyer,978-0-9673219-9-8,2004,"Science, Short Stories",Teens,"Taylor, Thompson and Bailey",Feeling century admit effort. Social garden production standard health. Require stand their training spend.,2.9,1552242
131,Mouth which walk former,Sandra Price,978-0-681-24221-0,1975,Science,Teens,Hunt-Flynn,Visit pull maintain. Section item step hit.,1.3,722262
132,Feel most moment very,Alicia Erickson,978-0-15-359272-0,2011,"Suspense and Thriller, Contemporary, Mystery",Adult,Mccarthy-Guzman,Allow fight develop level. Station explain respond pick animal big nation.,1.9,7631861
133,Tree truth argue,Eduardo Santos,978-0-686-78949-9,2006,True Crime,Teens,"Gay, Stewart and Novak",Enough site about course man prevent new. Morning tell career information pick yourself herself. Account effect least more. Half hundred region win usually against.,3.1,1150092
134,Camera second also open she,Christopher Hernandez,978-1-190-39151-2,2021,"Manga, Music, Cookbooks",Early Readers,Hobbs-Cohen,Marriage image also speak consumer short career. Image record eat likely opportunity college bad.,3.9,1647048
135,Democrat campaign within enjoy,Keith White,978-1-177-70109-9,2008,"Humor and Comedy, Science Fiction, Spirituality, Short Stories",Young Adult (YA),Clark-Deleon,Mean drop many citizen she represent parent with. Father with chair computer ago go. Reflect institution computer continue data.,4.5,1619655
136,Form computer local environmental,Katie Knox,978-1-969085-91-8,1998,"Memoir, Spirituality",Young Adult (YA),"Ibarra, Lee and Moore",Space sort audience line cultural much. Month seat local write sea like little evening.,1.1,3142762
137,Also body hair,Robin Woods,978-1-225-42936-4,2008,"Historical Fiction, Comics, Cookbooks, Humor and Comedy",Young Adult (YA),Cantu Ltd,Factor nation argue nature stock. Shake kitchen yet ready between condition often spring. Hit particularly air put.,4.2,4195822
138,Run garden them research,Michelle Rivera,978-0-639-51284-6,2005,"True Crime, Historical Fiction",Young Adult (YA),Mendez-Fry,Treatment behavior attorney help or. Doctor note every sister drop grow whole.,1.9,998728
139,Media check add pick,Scott White,978-1-57568-765-0,2005,"Mystery, True Crime",Teens,Barton-Carter,Four his wall national conference. None project seat Republican share until sure. Stuff good north line along area team drive.,3.0,388324
140,Sport fact election word,Sandra Graves,978-1-62696-407-5,2001,"Fantasy, Science Fiction, Christian, Historical Fiction",Teens,Perez Group,Less air local six writer relationship ask almost. Old particular few action. Media eight can director.,1.1,7808111
141,Analysis focus week,Michael Marshall,978-1-317-49672-4,1997,"Science, Satire, Christian, Crime",Early Readers,Johnson and Sons,News long or six great. Light right door day. Mouth factor finally seven near major.,2.0,1144918
142,Miss impact method,Matthew Brooks,978-1-05-015367-0,1977,"Religion, History, Music",Picture Books,"Salazar, Zimmerman and Tucker",I high figure threat. Mouth whether land it oil two present blue. Reach model strategy run would.,3.6,778888
143,Miss dog heart offer,Angela Johnson,978-0-324-06174-1,1981,"Humor and Comedy, Comics",Early Readers,Davis-Harris,Student challenge sometimes reflect probably prove network this. Goal order but movie visit.,1.0,1815446
144,Past none his,Evan Bradley,978-1-207-47822-9,1996,Religion,Adult,Lewis-Rivera,Rest standard though another country. Her city environmental believe pick pattern despite sport.,4.6,1549645
145,Floor doctor table,Michelle Johnson,978-1-05-097758-0,1976,"Self Help, Contemporary, Spirituality",Young Adult (YA),Hudson Ltd,Tough father analysis serve already environmental lead important. Society card forward smile board.,2.8,1384506
146,People account price,Cynthia Perez,978-1-4653-9236-7,2020,"Self Help, Memoir, Travel",Early Readers,Mann Inc,Billion rise example speech long question east. Allow decade education resource young. Paper industry skin region serve rock special.,1.7,1209282
147,Skin trade develop,Kayla Church,978-1-85616-456-6,1980,"Paranormal, Nonfiction, LGBTQ+, Cookbooks",Young Adult (YA),Smith Group,Along recognize forward until. Scene trial he them collection.,1.2,1091635
148,Agree father against,Elizabeth Brown,978-0-331-56108-1,2018,"Historical Fiction, True Crime, Art, Crime",Chapter Books,Pace-Lindsey,Base north ok son person can finally. Four low common argue small near. Treat seem similar half factor song peace.,1.8,644014
149,Room senior must exist service,Kim Simpson,978-1-921700-53-8,1989,Christian,Adult,Miller Group,Stand left from various again interest.,2.2,1425449
150,While exactly,Heather Travis,978-1-180-59417-6,1975,"True Crime, Action and Adventure, Historical Fiction",Picture Books,"Berry, Johnson and Jennings",Great represent seven Mr me.,2.2,200218
151,Painting down maybe election still,Colton Reed,978-1-251-47458-1,1988,"Crime, Science",Picture Books,"Maxwell, Roberts and Berry",Himself though usually fight ago become. Ok letter option. Worker table fight order share very.,3.7,1481875
152,Hour partner report,Joshua Kim,978-1-287-06043-7,2006,"Feminist, Art, True Crime, Historical Fiction",Early Readers,"Kelley, Lawson and Smith",Let according three be citizen language father. Situation behavior upon participant wait leave conference. Ok beyond try strategy watch author human. Will kind term they past.,2.7,624981
153,East pick,Joseph Cole,978-1-4202-1597-7,2016,"True Crime, Politics",Picture Books,Wilson-Johnson,Artist change not government begin. Air budget front enough check decide.,4.8,140957
154,Majority program,Lance Clay,978-1-343-67158-4,1983,"Horror, Historical Fiction, Music, LGBTQ+",Early Readers,Lynch Inc,Let policy yeah represent name.,4.8,510880
155,Task along nation sit,Michele Rivera,978-0-314-09514-5,2004,"Memoir, Contemporary, Music",Teens,"Choi, Christensen and Estrada",Democratic talk yes American left federal home. Employee police me actually. Maintain plant everything certainly less prove.,4.5,1767050
156,Character item position,Emily Bowman,978-1-4296-4910-0,1994,"Science, Poetry, Manga, Comics",Teens,Aguirre and Sons,Film set tough best. Region candidate a unit short establish discuss. Boy yeah two drop travel either writer.,4.8,236475
157,Top role seat economy,Christine Poole,978-0-248-62776-4,1975,"Short Stories, Classics",Young Adult (YA),Marshall-Fowler,Still glass leader item reach apply. Star decade art yard center memory require minute. Into short low center report region. Southern baby check beyond market.,2.5,7591566
158,Community sister early,Mark Harrison,978-0-365-22068-8,2011,"Classics, Feminist, Historical Fiction, Horror",Early Readers,Pierce-Jenkins,Democratic spend various culture. Than many herself American simple either want. Mr successful authority quite.,3.1,445517
159,Guy condition various,Amy Campbell,978-1-327-50331-3,1979,"Music, Mystery, Science Fiction",Young Adult (YA),Mays Inc,Read include land lawyer. Save cost list report issue detail around.,3.8,795968
160,To agent image approach allow,Donna Rodriguez,978-1-125-02939-8,1976,"Fantasy, Historical Fiction",Picture Books,Morrison-West,Fund under mouth. Measure unit government father always control. None very million anything arm teach because.,4.1,6143097
161,Southern enter collection,Nicholas Koch,978-0-04-923884-8,1972,"Biography, Crime, Satire",Adult,"Williams, Cook and Gibson",Describe I cup really discuss.,4.9,915982
162,Tree garden manage,Robert Miller,978-0-376-93930-2,1997,Philosophy,Chapter Books,Phelps-Stone,Without article whom plan husband. Management stay standard property consumer score majority. Open address themselves painting building job authority.,1.5,1586501
163,Matter major me word,Melanie Gardner,978-0-7273-9789-8,2017,Action and Adventure,Picture Books,Dawson Inc,Song message social. Animal push necessary since rate. Open hot successful yeah pressure Mrs standard school.,1.6,268322
164,Marriage whether realize special,Shane Nicholson DDS,978-0-88709-803-1,2020,Mystery,Chapter Books,"Gallagher, Rodriguez and Walker",Respond political look short research.,3.2,1539812
165,Teach back experience task already,Michael Clark,978-0-288-97260-2,1999,"Science, Suspense and Thriller, Business",Early Readers,"Leonard, Hall and Arias",Senior build black clearly business. During fast seem someone development conference others.,1.8,637647
166,Week lead three car author,William Collins,978-1-4246-7424-4,2013,Action and Adventure,Picture Books,Cross LLC,Area on interesting bank.,4.3,1935342
167,Light approach risk stock hope,Christopher Lewis,978-0-920631-64-5,2004,"Crime, Religion, Comics",Adult,"Goodman, Smith and Lucas",Sometimes individual experience hit billion.,3.9,879779
168,When itself,Daniel Casey,978-1-270-39259-0,1986,Christian,Early Readers,Woods-Taylor,Cause author maintain four help reduce. Leader environment heart discussion us method mouth. Week seat upon late ago.,3.6,786689
169,Quickly magazine of center different,Carl Ferrell,978-1-346-98479-7,1977,"Politics, Western, Classics, Religion",Young Adult (YA),Allen-Scott,Power best hour wide phone build. Yes around stuff senior well miss hour. Entire difficult include offer thing.,2.1,1294448
170,Imagine police,Sara Frost,978-1-9834-4451-7,2012,"Action and Adventure, Mystery",Teens,Smith and Sons,Mind certainly account public social. Home call court party. Old involve fear voice. Teach choose professor doctor executive.,4.1,1175009
171,Him well actually this,Michael Diaz,978-1-7340256-8-2,1997,"Christian, Fantasy, Classics, Psychology",Chapter Books,Adams-Oliver,Simply specific perhaps indicate none game lot. Camera identify measure want sell pull soldier. Staff cup draw.,3.1,1922529
172,Possible political,Amanda May,978-1-993841-67-2,2000,"Mystery, Poetry",Teens,"Small, Gray and Casey",Same to miss president try know method. Election study dog local dog.,4.3,1225430
173,Keep majority throw pattern,William Meyer,978-1-76544-471-1,1981,"Comics, Mystery, Crime",Young Adult (YA),West LLC,Man least able six tell public. Without draw pass. Capital clear its.,4.7,1257978
174,Enjoy store fire their,Brian Johnson,978-1-05-010627-0,1993,Business,Young Adult (YA),Mason-Myers,When course yeah meet artist.,2.6,14916
175,Guess history claim stock,Jennifer Brooks,978-0-498-85819-2,1994,True Crime,Chapter Books,"Jones, Bennett and Wall",Treatment first for when newspaper.,3.6,1361794
176,Admit return method picture,Robert Wright,978-0-08-726810-4,2014,Contemporary,Early Readers,"Wright, Elliott and Nguyen",Certainly set firm out I bit. Democrat democratic blood else apply trouble.,3.7,610145
177,Shoulder politics,Jamie Brooks,978-0-19-114508-7,2006,"Poetry, Western",Chapter Books,Harris Ltd,Final sometimes threat suffer white teacher level. Study far two former serious may. Others trouble prove fight staff special grow Republican.,3.2,367514
178,Safe cultural list,Jennifer Cooper,978-0-220-76555-2,2022,"History, Fantasy",Early Readers,"Campbell, Coleman and Hall",Figure some night not. Development scientist rise production your develop. Which little yet shoulder glass religious.,1.3,1908205
179,Case president air rest away,Pam Carter,978-0-390-86641-7,2006,"Memoir, Western",Chapter Books,York LLC,Into defense increase almost enjoy participant act. Kitchen always much stop. Sure knowledge sound nature project deep.,2.9,1195817
180,Stop risk believe edge view,Amy Brown,978-0-562-69058-1,1977,Science Fiction,Young Adult (YA),Scott-Avila,Information special some dream show. Source expert station government southern mission strategy.,4.0,1326126
181,Forward out item TV,Linda Norman,978-1-4204-8319-2,1986,"Mystery, Feminist",Teens,Cook-Hernandez,Start side bag leader but direction soldier.,2.2,208920
182,None learn production one,Cassandra Jennings,978-1-75521-819-3,2016,"Politics, Music",Early Readers,Garrison-Roberts,Mind pretty by true pass they.,3.9,691861
183,Word environment reveal national interest,Timothy Salas,978-1-374-17850-2,2017,"Fantasy, Self Help",Picture Books,Griffin-Fisher,Success candidate finish none discover series reflect.,1.6,4100844
184,Fast provide team,Mr. Karl Campbell,978-0-356-41414-0,2001,"Christian, Contemporary, Manga, Mystery",Chapter Books,"Shaffer, Owen and Thomas",While final just only present this help. Stand outside win pretty.,1.2,157833
185,Herself main,Shelly Wright,978-1-255-24884-3,1988,"Philosophy, Christian, Western, Cookbooks",Early Readers,"Flores, Scott and Cook",Fire happen close admit sign. Adult dark by accept rock by place.,1.6,1774470
186,Cut political writer of,Sarah Durham,978-1-55276-409-1,2002,"Religion, Comics, Science",Young Adult (YA),"Walker, George and Farmer",Free spend any coach artist without hard. End star career bank. Sure present next understand full.,4.1,1761845
187,Thing age exactly whole recent,Samuel Walker,978-0-200-38217-5,1998,"Western, LGBTQ+, Crime, Horror",Early Readers,"Stokes, Phillips and Weaver",Wish general free body which movement. Year other list word purpose past.,3.7,1951870
188,Very hospital,Zachary Williams,978-0-13-803207-4,2023,"Short Stories, Biography, Paranormal, Religion",Young Adult (YA),Davis Inc,Them itself stuff reveal describe. List plant sell condition resource until oil. Idea team make do finally life real.,3.3,88261
189,Civil couple view feel,Monique Decker,978-0-328-32433-0,1978,"Christian, Cookbooks, Mystery, Religion",Chapter Books,"Flores, Medina and Gomez",True agreement really yet effort investment. Space artist threat without happy for. Tend those cost young husband our me.,3.4,1771515
190,Paper agreement study,Michelle Norris,978-1-73095-945-5,1980,"History, Business, Fantasy",Adult,Hall Inc,Certain standard military this.,3.8,383779
191,Child listen,Michael Walter,978-0-14-899768-4,2024,"History, Historical Fiction, Romance, Nonfiction",Young Adult (YA),Schwartz-Lamb,Continue alone last current success once. Own deep start moment relate laugh. Between almost drop for.,4.7,1103781
192,Dark new know,Christopher Miller,978-0-625-66948-6,2020,"Music, Psychology, Business",Early Readers,"Miller, Olson and Scott",Especially property specific sport. Wide hotel close rich teacher pass. Avoid parent second gun claim cup.,1.4,1705417
193,Team feeling thus,Amy Lopez,978-0-926920-02-6,1991,"Psychology, Paranormal, Comics",Adult,"Singh, House and Berry",Why soon analysis lead position. Once imagine teacher sound choice would rock.,1.8,1372623
194,Interest analysis dark spring,Deborah Smith,978-1-79592-682-9,2013,"Nonfiction, Christian, Music",Early Readers,Flores PLC,Again matter tree address pass program put. Answer state figure avoid management customer husband.,2.2,480802
195,Stand success,George Murphy,978-0-9627145-3-5,1983,"Paranormal, Western, Romance, Historical Fiction",Picture Books,Banks LLC,He positive level clearly difference. Still early painting produce. Economy floor building husband.,4.7,1236068
196,Significant staff serious politics,Donna Richard,978-0-613-64615-4,1994,"Biography, Poetry, Christian, Contemporary",Early Readers,Taylor-Vaughan,Million set network although help. Check seem I himself allow attorney while. Tend event mouth nothing own.,3.1,1413450
197,First land week,Jordan Taylor,978-0-546-98406-4,2015,"Feminist, Memoir",Adult,Thompson-Ray,Share approach best kid find social. Above performance similar capital song trade. Suggest very car so coach.,4.0,1267539
198,First what company car,Ashley Reeves,978-1-4280-2800-5,1993,"Poetry, Western",Adult,Anderson LLC,Audience success great. Claim letter power region option five yes those. Edge occur difference break way.,4.8,1273482
199,Shoulder project stop,Michael Freeman,978-1-943161-43-0,2019,"Fantasy, True Crime, Christian",Teens,Powell LLC,Thus democratic likely glass. Hope responsibility prepare interest especially. Anything catch without effect.,2.2,997190
200,Fall help site,Shawn Mcpherson,978-1-9813-9059-5,2020,"Manga, Horror",Early Readers,"Dorsey, Calhoun and Simpson",I candidate sense lawyer town Democrat. Street blue respond me nice. President risk find girl wide impact. Always look when actually letter value performance once.,3.3,1468355
